Name,Final,Started,County,AcresBurned,PercentContained,Longitude,Latitude,Type,IsActive,CalFireIncident,Location
"LNU Lightning Complex (includes Hennessey, Gamble, 15-10, Spanish, Markley, 13-4, 11-16, Walbridge)",True,2020-08-17T06:40:00Z,"Napa, Sonoma, Lake, Yolo, Solano",363220,100,-122.14864,38.48193,Wildfire,False,True,See details below
Butte/Tehama/Glenn Lightning Complex (Tehama/Glenn Zone) ,True,2020-08-19T09:12:42Z,"Tehama, Glenn",19609,100,-122.4393,40.09571,Wildfire,False,True,Southwest of Red Bank Rd
Flint Fire,True,2020-08-19T16:44:58Z,Calaveras,55,100,-120.85258,38.03106,Wildfire,False,True,Flint St and Rock Creek Rd
Moc Fire,True,2020-08-20T14:26:08Z,Tuolumne,2857,100,-120.312565,37.813779,Wildfire,False,True,"Hwy 49 and Hwy 120, Moccasin"
Volcano Fire,True,2020-08-20T16:18:49Z,San Diego,45,100,-117.328234,33.454896,Wildfire,False,True,"De Luz Rd and Tenaja Truck Trail, west of Temecula City"
Coyote Fire,True,2020-08-21T14:36:08Z,Santa Clara,143,100,-121.68465,37.18725,Wildfire,False,True,Monterey Rd and Coyote Creek Golf Dr
Sheep Fire ,True,2020-08-22T22:02:57Z,Plumas,29570,100,-120.757,40.274,Wildfire,False,True,"Gold Run Road, Southwest of Susanville in Plumas County. "
W-5 Cold Springs,True,2020-08-23T08:24:24Z,Lassen,0,0,-120.281389,41.028611,Wildfire,False,False,"Cold Spring Road, West of Cold Spring Mountain "
Woodward Fire,True,2020-08-18T14:27:00Z,Marin,4929,100,-122.836701,38.018089,Wildfire,False,False,"Woodward Valley Trail, East of Olema"
Johnson Fire ,True,2020-08-28T16:21:25Z,Los Angeles,290,100,-118.36411,34.65979,Wildfire,False,False,"Johnson Road and Limeridge Dr, East of Elizabeth Lake in Los Angeles County"
Hensley Fire ,True,2020-08-30T11:11:55Z,Madera,688,100,-119.88673,37.08053,Wildfire,False,True,"Road 400 and Road 406, south of Hensley Lake in Madera County"
Hobo Fire ,True,2020-09-01T09:37:58Z,Trinity,0,0,-123.12461,40.82126,Wildfire,False,False,"East Fork Rd and Barney Gulch Rd, north of Helena"
Catholic Fire,True,2020-09-01T17:34:38Z,Lake,13,100,-122.637037,39.012743,Wildfire,False,True,"Highway 20 and Catholic Church Rd, east of Clearlake Oaks"
Valley Fire,True,2020-09-05T16:02:32Z,San Diego,16390,100,-116.692705,32.765615,Wildfire,False,False,"Japatul Road and  Carveacre Road, Southeast of Alpine"
Oak Fire,True,2020-09-07T13:26:45Z,Mendocino,1100,100,-123.3965,39.4935,Wildfire,False,True,"West of Highway 101--Big John Road & Skyview Road, Brooktrails Township, Willits"
Willow Fire,True,2020-09-09T06:04:43Z,Yuba,1311,100,-121.32361,39.3637,Wildfire,False,True,"Neptune Lane and Willow Glen Road, North of Smartville "
Sperry Fire,True,2020-09-08T22:27:00Z,Stanislaus,45,100,-121.18018000000001,37.46377,Wildfire,False,True,"Interstate 5 and Sperry Road, West of Patterson "
Schoolhouse Fire,True,2020-09-09T15:59:31Z,Siskiyou,45,100,-122.84057,41.68229,Wildfire,False,True,Schoolhouse Gap Rd And McAdams Creek Rd
Shackleford Fire,True,2020-09-11T10:05:44Z,Siskiyou,50,100,-123.021635,41.575549,Wildfire,False,True,"Shackleford Rd, southwest of Quartz Valley Reservation"
Fox Fire,True,2020-09-16T11:08:31Z,Siskiyou,2188,100,-122.847359,41.211022,Wildfire,False,False,"Fox Creek, Southwest of Callahan "
San Antonio Fire ,True,2020-09-16T16:00:33Z,Santa Barbara,111,100,-120.491594,34.773809,Wildfire,False,False,"Vandenberg Road and San Antonio Road, Vandenberg Air Force Base in Santa Barbara County. "
Zogg Fire,True,2020-09-27T16:03:27Z,"Shasta, Tehama",56338,100,-122.56656,40.53927,Wildfire,False,True,"Zogg Mine Road and Jenny Bird Lane, North of Igo"
Martindale Fire ,True,2020-09-28T17:08:09Z,Los Angeles,230,100,-118.4,34.563,Wildfire,False,False,"Bouquet Canyon Road, East of Hawthorne"
Candy Fire,True,2020-09-29T13:32:00Z,Riverside,227,100,-117.374419,33.764357,Wildfire,False,True,"Gavilan Road and Lake Mathews Dr, Perris in Riverside County."
Copper Fire ,True,2020-09-30T13:09:00Z,Amador,48,100,-121.003602,38.49375,Wildfire,False,True,"Copper Hill Rd. off Hwy 16, east of Rancho Murieta"
Pony Fire,True,2020-10-03T15:38:00Z,Sacramento,20,100,-121.039236,38.464074,Wildfire,False,True,"Pony Brown Rd and Ione Rd, Sloughhouse"
Lambert Fire,True,2020-10-04T12:46:20Z,Amador,21,100,-121.006635,38.424016,Wildfire,False,True,"Lambert Road and Carbondale Road, North of Carbondale"
Fields Fire ,True,2020-10-07T06:06:33Z,Yuba,56,100,-121.450982,39.181047,Wildfire,False,True,"Gold Field Road and Hammonton Road, Northeast of Marigold "
Irvine Fire,True,2020-10-11T18:04:00Z,Contra Costa,30,100,-122.104314,37.821737,Wildfire,False,True,Irvine Drive in Moraga 
Diamond Fire,True,2020-10-13T14:31:29Z,Calaveras,21,100,-120.64541,37.98337,Wildfire,False,True,"Highway 4 and Main Street, North of Copperopolis"
